
"Photos of a U.S. woman convicted of requesting the murder of her husband's contract were recently released of a close operation between police and men in connection with the sentence she received last year.Foreign media say one day in 2015, Sosa, who runs a gym in the United States state of Texas, tried to kill someone he knew :The man known as Gustavo was a man who had been helped by Sosa in the past.Sosa's wife Lulu, whose husband he was hired to kill, did not know that the two knew each other.Sosa, who had thought it was a joke at first, was shocked when he received a recording of his wife's words to Gustavo.Lulu reportedly ordered a "" firing squad "" to point to Gustavo with his temples searched. A fake crime scene photo from Sosa, being decorated by police, capturing a British daily email home page, and a local police officer who received a tape launched an arrest attempt against Lulu.First, Gustavo introduced two police officers to Lulu, his other contract killer. Police then dressed up as if he was shot by applying blood like ink to one side of his head, and then disguised him as a body in a sand hole and took a photograph.Sosa lived in a separate hotel on the outside.Lulu, who received a photo from a police officer who was set up as a contract killer, had a big laugh on the spot. But the laughter was the end. Lulu who asked to kill a husband. Capture the Daily Mail Web site in the U.K.. Lulu, who was caught on a request to kill a husband's contract, pleaded guilty to his guilt. He did so out of malice affined in his financial relationship with his husband.The local court sentenced Lulu to 20 years in jail last October.As the police recently released the photographs of the lying down the hole, it was not long before the public learned what happened.`` It felt like lying in a dirt hole was very terrible, '' Sosa said. `` I did not know that our marriage would end that way. ''▽ Set up a World Daily News Channel for Best Picks (clicked) by reporter Kim Dong-hwan (clicked) and received the prize in Gwangju = The Korea Institute of Animal Health and the Korea Foundation for the Memorial of Cultural Properties was discovered Monday morning in the North Korean Army's wall. ▽ Gwangju : The maximum land where the missing persons were once again suspected of being buried was found in the prison. As more than one drilling operation has already been carried out, along with five pipes that were discovered earlier to be 60-70 cm underground, it is likely to affect the direction of excavation of the rocky burial. The Korea Cultural Properties Research Institute, commissioned by the May 8 Memorial Foundation, has been searching for a burial ground at a former Gwangju prison for three days. The area is three meters long and 10 meters long, and is being divided into four areas (one grid), where the soil is removed by a small amount with a hoe. The first and second pits east of the jail used excavators and shovels to dig up the ground to 1.5 meters. In the process, an unidentified plastic material and three steel pipes were found again. The soil turned black where the pipes were found. We have found black soil, not the yellow one in the background of the discussions, said an official at the Cultural Properties Research Institute. It was confirmed that the five 54 ㎜ piping (4 plastic materials and one steel pipe) discovered on the first day of excavation work were connected to the official residence of the Prison Service. The foundation and researchers confirmed that they are not currently using communication lines and water pipes, and they removed them and continue to dig them up. The pipes are buried outside the walls of the North (Damyang) prison, and are about 117 meters from near the tennis courts to the official residence of the Prison Service. This is where the excavation of the rock burial will be conducted. It is expected that the sale of the rock will have a considerable impact on the direction or outcome of the investigation as the pipes again were discovered underground at a depth of 1m, which was judged to be more likely to be found.▽ New South Korean prison = On the morning of July 8, the National Defense Memorial Foundation and the Korea Cultural Properties Research Institute were also found to have cut down the remains of the bodies in the vicinity of the North Wall of Gwangju Prison in northern Gwangju. Kim Yang-rae, executive director of the Memorial Foundation at hgryu77@newsis.com confirmed yesterday that "" we visited the site with officials who were in charge of the facility in 1980 and found that the remaining pipes were installed, and that more were laid before the prison. "" "" We are in the process of finding the remains of the burial ground based on testimony from three-car officers at the time of May 18th, "" he said. Meanwhile, the foundation secured a document of testimony on May 29, 1995 that Kim, the head of the 3rd Airborne Brigade's main unit, sold 12 bodies with his subordinates and ordered them to be sold to a certain burial site. The document also contained a map of the place of sale. Kim also said, ' I did not use a coffin and buried two bodies in straw bags. ' The foundation believes there are at least six holes. Shortly after May 18, eight bodies were found behind the prison's doors and three bodies were found dead in the middle of a burial ground. The May 31, 1980, fact-finding paper on the incident from the martial law headquarters said 27 civilians (28 data on security forces) were killed in what were called "" prison raids. "" Simple calculations have not confirmed the identity and whereabouts of 16 to 17 people. guggy@newsis.com> relationship and regular checks on Japanese media, such as Donald Trump, Moon Jae-in and president of the United States president to accelerate the report of the seventh day of the summit, traveling between the two heads of state.A close eye on message. Some have been holding back that the Korea-U.S. summit failed to reach a "" honeymoon "" relationship with the U.S. and Japan. 8th niongeijai (Nikkei) Trump, the president, both on a honeymoon during a visit to Japan and South Korea reported that the strong sense of boundaries. And Trump the president of the stay and South Korean media said and come up with differences in this ‘Daewoo’ interpretation. Trump, the president enjoys playing golf with Prime Minister Abe, 3 days in Japan, including, but the itinerary in 2 Days & 1 Night in shorter than him. The presidential office of Cheong Wa Dae explained that it was more than a concession as parliamentary speeches were scheduled, it added. Japanese newspapers that reported the Korea-U.S. summit on the first page of July 8. The Japanese media reported that the two leaders confirmed their alliance, but showed a gap in FTA and dealing with North Korea. The Nikkei also reported that the two countries had a difference over North Korea at the Korea-U.S. summit. Trump the president is in an interview on the eve of fierce criticism on North Korea South Korea to refrain from as consideration for the Nikkei said. But Trump does not rule out military action against the president had pointed out is future relations between the two countries could be the embers of conflict. Nikkei said that the two leaders North Korea's nuclear and missile threats on the response to strengthen ties between Moon Jae-in who are in government they sought, but the United States and China.General review, it's hard to have the same strength and U.S.-Japan relations. The Japanese daily Asahi Shimbun said Trump at a news conference after summit talks with South Korean president is “together” noting several times the word “Korea is a very important countries”.Stressed that he said. Still, like Nikkei, the Korea-U.S. relationship is less than what the U.S. and Japanese leaders declared on July 6 that they would go together 100 percent. Asahi pointed out that South Korea's delicate stance on North Korea is casting a shadow on the relationship between South Korea, the United States and Japan.The newspaper quoted a source saying, "" We can not say that the relationship between Korea and the United States is good, "" and pointed out that this is having a negative influence on the response to North Korea. The U.S., for instance, was reluctant to agree on the need for a nuclear submarine, citing the Korean Defense Ministry's objection. "" It is North Korea that benefits from the loss of aid to South Korea and the United States, "" he said. On the other hand, the Japanese military sexual slavery, and raise the ‘Dokdo,’ damage to Japanese media the Korean government's Eve dinner menu also expressed strong dissatisfaction to a dinner invitation. As it is confirmed that Trump's visit to Korea and Japan is meant to join forces to deal with North Korea, it is believed that the Japanese government is trying to "" throw cold water "" and that South Korean government fears over the issue are groundless.  Reporter Lee Hye-mi /ham@heraldcorp.com"
"The United States president mellania the wife of Donald Trump Trump, Jung-gu, Seoul, Korea Tuesday afternoon, Ms. Habib House in 'Girls Play 2 (girls play 2)' attended the event.And a congratulatory address. The U.S. Embassy's campaign, titled ' Girls ' Play 2, ' aims to increase girls ' participation in school sports activities based on public support for the 2018 Pyeongchang Winter Olympics as part of the nation's public diplomacy campaign. - 10:17 AM / by Josh LowensohnSchild smile on the joint photo collection of news 1 ©oider's photos, "" Auspicious Assembly""Display photos with Mrs. Kim, and "" Hardy Robot Sleep "" by Park Seung-ah from Seoul 1 July, Donald Trump the president a 'Girls Play 2' campaign in the U.S. embassy compound and to visit Korea in Jeong-dong, Seoul, Mrs. mellania the girls are.The boy has the right to enjoy the same sports as they feel, what to make a toast.After the congratulatory speech, about 80 female students gave enthusiastic applause and applause, and Mrs. Melania grinned broadly. In the United States, his hometown of Slovenia received from criticism is 'not good speech.' to mock accent a sincere 'loud' of the Korean middle school students is Mrs. mellania the cheers of ' clowns.Go to heaven 'the smile of the United States president level of Donald Trump Tuesday afternoon, Ms. Trump's wife, mellania in Habib House, Jung-gu, Seoul, Korea' Girls.Play two (girls play 2) attended the event encouraging students to myself. ' The U.S. Embassy's campaign, titled ' Girls ' Play 2, ' aims to increase girls ' participation in school sports activities based on public support for the 2018 Pyeongchang Winter Olympics as part of the nation's public diplomacy campaign. © 1 News and 2017.11.7 news 1 picture from a South Korean press corps and green cards for children is Mrs. mellania hwanyeongdan a gift to in Chapter 32 paintings to the file, the president and first lady.In everything, with a big smile, ""Thank you"". Mrs Melania is known to be very interested in children's and education issues.Trump Ms. mellania of hospitality in Korea, Jung third tour after the 1st tweet : (Twitter galmuri) © news, go to China.8th mellania official Twitter at ""Moon Jae-in, president and Mrs. Kim Jung-sook, the South Korean people, thank you for your hospitality."" and Ms. Kim and the Secretary of State, faced wreathed in smiles and pictures.Year.Netizens responded, "" When I saw Mrs.Melania sitting with Japan's wife Abe Akie, I felt like I was smiling. "" They answered, "" When I was smiling, the First Lady was very strict. "" When one Internet user wrote that Melania seemed to laugh especially in Korea, another said, At least he or she had a better impression than Japan.I would like to hear from you guys who have visited Japan on the 5th, Mrs. Melania Trump (right) and Ms. Abe Akie (left) → AFP = Seunghee News.Report! Stephen Hawking's "" Web Crowd AP Summit : An AI could replace humanity entirely / The Human Important Technology Show. At the Web-Quiet Technology Conference in Lisbon, Portugal on July 6, we said, "" In theory, computers could copy and jump over human intelligence, "" adding, "" If man could not deal with the worst case of AI. ""Scientists and businesses that develop AI have argued that it is impossible for AI to develop independently in any way with current technology. But Hawking says, "" There could be not only a strong AI weapon that works independently, but also a technology that represses many people as being able to do so, and that the economic system could only be tested enough to collapse. ""It is not the first time that Professor Hawking warned of the dangers of AI. Along with Tesla's CEO, he is considered one of the most famous AI pessimists. Earlier this year, the Times said, "" We need to form a global government to control AI. "" Recent Wired interviews in the United States said, "" Someone's going to create AI by evolving themselves and cloning themselves. ""Professor Hawking sent a video message at the Summit on the Internet company Tensent in Beijing on July 5 saying, "" Humans now have to preserve species and move out of the Milky Way to live in the next several million years. "" In fact, he has a Breakthrot Star shot, a break through project that launched a spacecraft that was shipped to Uriball, an alpha center several trillion kilometers from the solar system along with Facebook founder Mark Zuckerberg and Russian venture investor Yuri Milner.It's like firing lasers into a space with a flimsy sail, and getting some wind in it. He calculates that because there is no air resistance, the speed can continue to increase and fly at a speed of 160 thousand kilometers per hour. The project, which will take 20 years to launch, will cost an estimated $ 10 billion (approximately 11.11 trillion won). Once this technology is complete, we can get to Mars in less than an hour, even Pluto in a day, and we can catch up with Voyager 1, which was launched in 1977 and went over 40 years, Hawking said.  [Police reporter Park Geon-hyeong defying@chosun.com][ Direct to Dooson.com] - Compritations ⑨ Chosun Ilbo & chosun.com, No reproduction or redistribution without permission"
"▽ Opening of self-employment (p.s.Lee, Taeho) _ Less than 5 million won per person out of 10 self-employed people … 52 percent of them will not be paid extra money to work for a private business organization as of August. Analysts say that last year, more and more people were forced to leave their stable jobs in the aftermath of the restructuring and start their own businesses to earn a living. The figures were explained in the May 8, 2017, "" Results of a Non-payable Labor Additional Survey on Economic Activities and Population. "" The survey was conducted in August this year by a non-paid worker from 32,000 households who started his own business within the past two years. When referring to business funds meant for seed money, less than 5 million won was the largest, or 28.3 percent of the total. It was in the order of 5 to 20 million won, 22.0 %, 20,500-500,000,000 won, 500-100,000,000 won, 16.6 %, 100-3,000,000,000 won, and 1.2 % more than 300 million won. In other words, 50.3 percent of the self-employed made up less than 20 million won each, more than half of them. Compared to the previous survey, August 2015, the range of 5 to 20 million won increased by 3.5 %, the highest growth rate. In general, it is recognized that the more money a person has, the higher the expected profit or stability. The results of this year's survey show that small businesses are running their own businesses. The situation has become worse in recent years. If the starting time of small business is shortened from two years to less than one year, the proportion of small business owners will grow to 5,310,000 won and 5,000-200,000 won, respectively. According to the method of raising the seed money, 68.8 percent of the money was raised by themselves or their family, but not a few borrowed money was. Banks, insurance companies and mutual savings and financial companies ranked at 1.4 percent, with 31.5 percent, followed by relatives and partners ' funds, 7.8 percent, 5.0 percent borrowing from others, and government support or support.[Graphic] Only half of the self-employed are industrial account…..That is a slight rise from last years…That means those who have run their own businesses have not yet accumulated capital. The fact that the most difficult part of starting the project was the ' Business Financing ' (28.6 %) was the most important factor to support. Considering that the number of self-employed people without any employees rose 1.3 percent from two years ago, the results of the survey shows that the ratio of self-employed businesses in the era has grown to that extent. More than half (57.4 percent) of those who entered the business were paid workers. It is very possible that he lost his job after earning a stable salary and was forced to work for his own business to make ends meet. 88.9 percent of the respondents said their business was ready for less than a year. In one to three months, 52.0 % were also found to be more than half. The worsening overall conditions, including the size of the business funds, were the effects of an increase in the self-employed without employees, said Vienna Hyun-jun, director of the office`s Employment Statistics Division, who lost their jobs in the shipbuilding industry last year. Other business motives reported were : ' I want to run my own business myself ' with 71.0 % saying ' I can't work as a wage earner, ' and 12.5 % others saying ' I want to work as a wage earner '. The problem is that the prospects are not bright since the self-employed are already saturated. That is the result of analysis on changing businesses while doing other self-employment. The reasons for the trade shift were most often with 36.8 percent of ' to switch to more lucrative businesses. ' The following were due to sluggish business ahead (27.0 %) and no prospect of business ahead (17.0 %). That means the punishment was not good enough. Last month, 39.0 percent of the respondents had been in business for more than five years. It was followed by less than two years (32.2 percent) and four years (28.8 percent) from the previous two years. Call us online on 2vs2@yna.co.kr (be sure to give us the title of the article) and gather the latest trends here (click!) to set the latest trends (click!)"
"Intermediarism of a 30-something woman, Interpol's Red Wanted to arrest husband, B's first love, and Busan Southern Police Department Police Department said, "" If returned to Korea, it would be possible to investigate whether a married couple was found missing and find out crime. "" A woman in her thirties who is a leading suspect in a honeymoon couple's disappearance from her 15-story apartment building in Busan has been arrested in Norway. According to Busan Southern Police Station, police identified Mr. A as a possible suspect in the incident and are in the process of delivering criminals in cooperation with the Foreign Affairs and Justice Ministry. Upon his return home, the police will question the newlyweds and find out their whereabouts and the suspicion of a crime. A South Korean police officer said, I asked Interpol or the International Criminal Police Agency for a red hunt for a man who left for Norway last June, and was arrested in August. We will seek an arrest warrant for the suspect when he is extradited to Korea. The Busan Newlyweds scandal, which took place in May 2016, was so questionable that SBS television network "" I Want to Know About It, "" dealt with the disappearance of an empty honeycombed couple. Her husband, 35, and his wife, C, who married in November 2015, lived on the 15th floor of an apartment in Suyeong-gu, Busan. The actor's wife, who will be returning home around 10 p.m. on May 27, 2016 and her husband, who will be returning home around 3 a.m. on May 28, was caught on CCTV. After the couple left their apartment, no CCTV footage was taken. The couple's disappearance was a mystery. A CCTV scene shows his wife (left) and husband B returning home from Busan. The father of Mr. B called Mr. B from the morning of the day of his son's disappearance, but he could not reach him. When I went to the store where my son worked, the restaurant business executive just said, I would text him ' I want to take today off today ' in the morning of 28th. At the same time, her fellow actors received a text message from her saying, I can't perform. The fact that he called her by text message instead of by telephone, and the words were not written as usual, led to her being honored, fellow actors testified. As her co-star D repeatedly called her husband on the morning of July 29, he answered the phone instead and hurriedly hung up. The investigation began on June 2, 2016, the sixth day of disappearance, when family members reported their missing to police. Police searched every nook and cranny of the water tank, septic tank, and basement storage area on the roof of the apartment building, hoping to find out whether it had completely damaged a web of CCTVs. The couple had no external signs of invasion and could not find any signs of a fight inside. Only two of the home's cell phones, wallets, identification, passports, and laptops had been lost. As the police tracked the locations of the B couple, her husband's cellular phone signal went off near Busan Gijang County on the day of the report. The signal of his wife's cell phone disappeared near Cheonho-dong in Seoul at 8:00 p.m. The couple's cell phones were cut off at the Seoul and Busan marathons, some 400 kilometers away from each other. At the time, his wife, C, was pregnant. Mr. C was captured as the likely suspect when the police began investigating people around. A is said to be the first love of husband B. It is said that Mr. A married another man in the opposite part of the family, but he kept seeing Mr. B. A divorced person has been harassing the two since B tried to marry C, according to acquaintances to the police. When Mr. B married Mr. C, Mr. A remarried and went to Norway. However, Mr. A said that he kept in touch with Mr. B in Norway, too. B used two cell phones and one was only used to call Mr. A. B ran a salmon tuna restaurant because he recommended selling Norwegian salmon. According to police, the man entered Korea with his husband in mid May 2016 before the incident took place. And the couple headed to Norway in early June, two weeks earlier than scheduled to leave. While staying in Korea for about a month, A never used a credit card at all. According to police polls, A told her mother shortly before she entered Korea that she would travel to Africa and ask for 10 million won in cash. When she came to Korea, not Africa, she did not contact her mother. Police concluded that the "" A "" man was behind the disappearance of the B couple and appointed her as a possible suspect in August 2016. Police used the Internet and telephone to investigate Mr. A in Norway. Then, he hired a lawyer from Norway to respond. However, he disappeared from December 2016 and police asked Interpol for a red warrant last March. Five months later, A was arrested by Norwegian police in August. The Justice Ministry and the Foreign Ministry are in the process of delivering criminals, and the Busan Southern Police Station will investigate when Mr. A is returned to Korea. A policeman at Busan Nambu Police Station said, "" When Mr. and Mrs. A entered Korea and did not even call their family members, they were not willing to leave Norwegian lawyer two weeks earlier than planned. "" However, it does not seem easy to clarify the criminal charges against him. The investigation was not conducted properly right after the disappearance, so we have to rely on Mr. If he fails to prove his alibi before and after the disappearance, we will continue to question him based on the evidence we have obtained so far, said a Busan Southern Police Station official. ▶ lee.eunji2@joongang.co.kr press : Lee Eun Ji, Busan, Korea mobile meet in JoongAng Ilbo [Facebook], cacao, [Plus my friend ] [Mobile web] © 5 Kits combine the JoongAng Ilbo (http://joongang.co.kr) and jtbc content hub of stability, unauthorized war damage and redistribution of Trump, 'Korean spindle chuck' (=, Yonhap News Agency, Seoul, Korea) ltd co.Journalist : Donald Trump, the United States president is Bill Clinton in July 1993 and in the morning of November 8, the Assembly Hall after his speech in 24 years after the president the National Assembly and raise one's thumb.to exist jeong@yna.co.kr( : Seoul, Yonhap News Agency) gimbeomhyeon business president said Wednesday parliament and the Korean National Assembly and people through the American Journalist : Donald Trump made special note of thanks. State visit to Korea in parliament president, Trump began his speech, "" the Republic of Korea, representing the American people a chance to talk to people in the plenary session here.Thank you for a chance to speak, '' Gibbs said. Trump, the president, especially one night two days of ""I was completely in awe in Korean classical and modern look and mellania."" and South Korea said a state visit for the start of his comments. Moon Jae-in, thank you once again for president greetings. Trump said, ""The president and first lady nice to such a warm welcome at the party in Cheong Wa Dae yesterday (Tuesday)."" is president. Call us online on kbeomh@yna.co.kr (be sure to give us the title of the article) and gather the latest trends here (click!) to set the latest trends (click!)"
